{
  "schemaVersion": "1.0.0",
  "title": "数据结构算法库",
  "scenario": "code",
  "lang": "zh",
  "mode": "full",
  "description": "完整的数据结构和算法实现库，包含常用数据结构和算法",
  "spec": {
    "tech": {
      "language": "TypeScript",
      "framework": "N/A"
    },
    "features": [
      "链表 (LinkedList) 实现",
      "栈 (Stack) 和队列 (Queue)",
      "二叉搜索树 (BST)",
      "哈希表 (HashMap)",
      "图 (Graph) 数据结构",
      "排序算法集合",
      "搜索算法实现",
      "时间复杂度分析"
    ],
    "io": {
      "input": "泛型数据类型 T，支持各种基础数据类型",
      "output": "完整的数据结构类和算法函数，包含增删改查操作"
    },
    "codeRules": [
      "使用泛型支持多种数据类型",
      "每个数据结构提供完整的 CRUD 操作",
      "包含详细的时间和空间复杂度注释",
      "提供可视化演示和测试用例",
      "遵循面向对象设计原则",
      "包含性能基准测试",
      "提供算法动画演示"
    ]
  },
  "tags": ["data-structure", "algorithm", "typescript", "computer-science"],
  "author": "EP Team",
  "version": "1.0.0"
}
